{
  "$schema": "https://json-schema.org/draft/2020-12/schema",
  "title": "Song Dynasty Notation Music Piece",
  "description": "Digital representation of a Song dynasty music piece (this includes Lülüpu, Gongchepu and Suzipu notations)",
  "type": "object",
  "properties": {
    "version": {
      "description": "The version number of the notation format used by the piece.",
      "type": "string"
    },
    "notation_type": {
      "description": "The notation type the piece uses, it must be either 'Suzipu', 'Lvlvpu' or 'Gongchepu'.",
      "type": "string",
      "enum": [
        "Suzipu",
        "Lvlvpu",
        "Gongchepu"
      ]
    },
    "composer": {
      "description": "The piece's composer.",
      "type": "string"
    },
    "mode_properties": {
      "description": "The properties referring to the mode of the piece.",
      "type": "object",
      "properties": {
        "gong_lvlv": {
          "description": "The Lülü pitch corresponding to the mode's 宫.",
          "type": "integer",
          "minimum": 0,
          "maximum": 10
        },
        "final_note": {
          "description": "The mode's final note, must be either '宫', '商', '角', '变', '徵', '羽', or '闰'",
          "type": "string",
          "enum": [
            "宫",
            "商",
            "角",
            "变",
            "徵",
            "羽",
            "闰"
          ]
        }
      }
    },
    "images": {
      "description": "This field contains the list of relative paths to the image files belonging to the piece in the right order.",
      "type": "array",
      "items": {
        "type": "string",
        "description": "Relative path to the image file."
      }
    },
    "content": {
      "description": "List of all boxes corresponding to the individual semantic unities of the piece, e.g., title characters, preface characters, or musical information boxes containing the lyrics and notational information.",
      "type": "array",
      "items": {
        "type": "object",
        "description": "Properties of a single box.",
        "properties": {
          "box_type": {
            "description": "The annotation type of the box, i.e., 'Title', 'Mode', 'Preface', 'Music', or 'Unmarked.",
            "type": "string",
            "enum": [
              "Title",
              "Mode",
              "Preface",
              "Music",
              "Lyrics",
              "Unmarked"
            ]
          },
          "is_excluded_from_dataset": {
            "description": "If true, when exporting the image dataset from the corpus, this box is not included. This is advisable if the image data in the box is distorted by artifacts or the annotation content does not fit to the image content.",
            "type": "boolean"
          },
          "is_line_break": {
            "description": "If true, the box is taken to be the last box before a column break.",
            "type": "boolean"
          },
          "text_coordinates": {
            "description": "The segmentation box coordinates (upper left and lower right corners) for textual information, including lyrics.",
            "type": "array",
            "minItems": 2,
            "maxItems": 2,
            "items": {
              "description": "The point's x and y coordinates.",
              "type": "array",
              "minItems": 2,
              "maxItems": 2,
              "items": {
                "type": "integer",
                "minimum": 0
              }
            }
          },
          "text_content": {
            "description": "The textual content of the box. A text-based box may contain up to one Chinese character.",
            "type": "string"
          },
          "notation_coordinates": {
            "description": "The segmentation box coordinates (upper left and lower right corners) for notational information.",
            "type": "array",
            "minItems": 2,
            "maxItems": 2,
            "items": {
              "description": "The point's x and y coordinates.",
              "type": "array",
              "minItems": 2,
              "maxItems": 2,
              "items": {
                "type": "integer",
                "minimum": 0
              }
            }
          },
          "notation_content": {
            "description": "The notational content of the box. A notational box may contain a suzipu-describing string like '0;'. This should only be filled for boxes of type 'Music'.",
            "type": "string"
          }
        },
        "required": [
          "box_type"
        ]
      }
    },
    "additionalProperties": false
  },
  "additionalProperties": false,
  "required": [
    "version",
    "notation_type",
    "composer",
    "mode_properties",
    "content"
  ]
}